id,brand,campaign,industry,status,priority,kitPath,dashboardPath,manifestPath,nextAction
ricks-cabaret,"Rick's Cabaret & Steakhouse Central City","Black Hawk Corridor Nightlife Escape","Hospitality / venue","Live kit + Claude operator kit attached",Hot,/ricks-cabaret-campaign-kit/,/ricks-cabaret-dashboard/,/ricks-cabaret-campaign-kit/manifest.json,"Send Rick's owner/operator dashboard and onboarding link by SMS, then review the NY case editorial reader."
stans-auto,"Stan's Auto Sales, LLC","Westminster Family Car Finder","Auto sales","Shipped + prospect board live",Active,/stans-auto-sales-campaign-kit/,/stans-auto-sales-campaign-kit/prospects/top-20-prospects.html,/stans-auto-sales-campaign-kit/manifest.json,"Use the Top 20 Auto Prospect board to clone the kit for nearby auto categories."
deer-road,"240 Deer Road, Evergreen","Evergreen A-Frame Retreat","Real estate",Shipped,Active,/240-deer-road-campaign-kit/,/240-deer-road-campaign-kit/#customer-home-buying-kit,/240-deer-road-campaign-kit/manifest.json,"Send the two-link handoff to listing agents: public campaign kit plus customer home-buying kit."
deer-road-template,"240 Deer Road Template Demo","Evergreen A-Frame Retreat template","Real estate template","Demo / template",Reference,/240-deer-road-template-demo-campaign-kit/,/240-deer-road-template-demo-campaign-kit/#customer-home-buying-kit,/240-deer-road-template-demo-campaign-kit/manifest.json,"Use as a controlled template reference when building new property kits."
colorado-gambler,"Colorado Gambler","Casino Guide Launch 2026","Casino guide / publishing vertical","Asset pack shipped",Active,/cg-campaign-kit/email/newsletter-casino-guide.html,/cg-campaign-kit/banners/banner-leaderboard-728x90.html,/cg-campaign-kit/manifest.json,"Use the manifest and newsletter preview as the proof path until a full landing page exists."
copress-satcom,"CoPress Dashboard / SATCOM","Publishing Spine","Publishing operations",Shipped,House,/copress-satcom-campaign-kit/,/copress-satcom-campaign-kit/#operator-kit,/copress-satcom-campaign-kit/manifest.json,"Use as the owner/operator explanation kit for new SATCOM publishing prospects."
